{
  "schema_version": 1,
  "seed": 20261012,
  "as_of_day": "2026-10-12",
  "tier": "camp",
  "resources": {
    "planks": 4.5,
    "stone": 0,
    "seeds": 2
  },
  "earned": {
    "planks": 12,
    "stone": 1,
    "seeds": 3
  },
  "structures": [
    {
      "id": "cottage_1",
      "status": "complete",
      "stage": 3,
      "progress": 1,
      "completed_day": "2026-10-12"
    }
  ],
  "decorations": [],
  "milestones": [],
  "stats": {
    "lifetime_turns": 42,
    "active_days": 5,
    "streak_days": 3,
    "tools_seen": [
      "claude"
    ]
  },
  "founders_stone": null,
  "demo_capped": false
}
